{"options":{"leftPanelEnabled":true,"minWidthBreakPoint":610,"overrideFullScreen":false,"pagingEnabled":true,"pessimisticAccessControl":false,"preserveViewport":false,"rightPanelEnabled":true,"searchWithinEnabled":true,"theme":"uv-cy-GB-theme"},"modules":{"dialogue":{"content":{"close":"Cau"}},"downloadDialogue":{"options":{"confinedImageSize":1000},"content":{"currentViewAsJpg":"Golwg presennol (jpg)","download":"Lawrlwytho","editSettings":"Golygu'r dewisiadau","entireDocument":"Y Ddogfen Gyfan ({0})","entireFileAsOriginal":"Y ffeil gyfan ({0})","noneAvailable":"Nid oes unrhyw opsiynau lawrlwytho ar gael.","pagingNote":"Dad-ddewiswch 'Arddangos Dwy Dudalen' i weld dewisiadau pellach.","preview":"Rhagolwg","title":"Lawrlwytho","wholeImageHighRes":"Y ddelwedd gyfan o ansawdd uchel ({0})","wholeImageLowResAsJpg":"Y ddelwedd gyfan o ansawdd isel (jpg)"}},"embedDialogue":{"options":{"embedTemplate":"<div class=\"uv\" data-locale=\"{0}\" data-config=\"{1}\" data-uri=\"{2}\" data-sequenceindex=\"{3}\" data-canvasindex=\"{4}\" data-zoom=\"{5}\" data-rotation=\"{6}\" style=\"width:{7}px; height:{8}px; background-color: #000\"></div>\n<script type=\"text/javascript\" id=\"embedUV\" src=\"{9}\"></script><script type=\"text/javascript\">/* wordpress fix */</script>"},"content":{"customSize":"Maint ddewisol","height":"Hyd","instructions":"Er mwyn ymgorffori'r eitem hon ar eich gwefan, cop√Øwch a gosodwch y cod isod:","title":"Ymgorffori","width":"Lled"}},"footerPanel":{"options":{"downloadEnabled":true,"embedEnabled":true,"fullscreenEnabled":true,"minimiseButtons":false},"content":{"download":"Lawrlwytho","embed":"Ymgorffori","exitFullScreen":"Dianc o'r sgrin lawn","fullScreen":"Sgrin lawn"}},"genericDialogue":{"content":{"emptyValue":"rhowch rif","invalidNumber":"Rhowch rif dilys","noMatches":"Dim canlyniad sy'n cyfateb.","ok":"GWELD","pageNotFound":"Nid yw'r eitem yn cynnwys tudalen gyda'r rhif a nodwyd. Ceisiwch cyfnewid y math i 'delwedd'.","refresh":"Ailosod"}},"helpDialogue":{"content":{"text":"testun i'w osod","title":"Cymorth"}},"moreInfoRightPanel":{"options":{"panelAnimationDuration":250,"panelCollapsedWidth":30,"panelExpandedWidth":255,"panelOpen":false,"textLimit":4,"textLimitType":"lines"},"content":{"collapse":"Cuddio Mwy o Wybodaeth","collapseFull":"Cuddio'r Galeri","expand":"Ehangu Fwy o Wybodaeth","expandFull":"Ehangu'r Galeri","holdingText":"Eich modiwl fan hyn!","less":"llai","more":"mwy","noData":"Nid oes data i'w arddangos","title":"Mwy o Wybodaeth"}},"pagingHeaderPanel":{"options":{"localeToggleEnabled":false,"pageModeEnabled":true,"pagingToggleEnabled":true},"content":{"close":"Cau","emptyValue":"Mewnosodwch werth","first":"gyntaf","firstImage":"Delwedd Gyntaf","firstPage":"Tudalen gyntaf","folio":"ffolio","go":"GWELD","help":"Cymorth","image":"Delwedd","last":"Olaf","lastImage":"Delwedd Olaf","lastPage":"Tudalen Olaf","next":"Nesaf","nextImage":"Delwedd Nesaf","nextPage":"Tudalen Nesaf","of":"o {0}","oneUp":"Gweld un dudalen ar y tro","page":"Tudalen","previous":"Blaenorol","previousImage":"Delwedd Flaenorol","previousPage":"Tudalen Flaenorol","settings":"Dewisiadau","twoUp":"Gweld dwy dudalen ar y tro"}},"seadragonCenterPanel":{"options":{"controlsFadeAfterInactive":1500,"controlsFadeDelay":250,"controlsFadeLength":250,"defaultZoomLevel":0,"navigatorPosition":"BOTTOM_RIGHT","pageGap":0.01,"trimAttributionCount":150},"content":{"acknowledgements":"Cydnabyddiaethau","goHome":"Gweld y maint gwreiddiol","imageUnavailable":"Nid oes delwedd ar gael","next":"nesaf","previous":"blaenorol","rotateRight":"Cylchdroi i'r dde","zoomIn":"Closio","zoomOut":"Gwrthglosio"}},"searchFooterPanel":{"options":{"elideDetailsTermsCount":20,"elideResultsTermsCount":5,"pageModeEnabled":true},"content":{"clearSearch":"Clirio bob dewis","defaultLabel":"-","displaying":"Dangos {0} {1} o {2}","enterKeyword":"Mewnosodwch allweddair","image":"delwedd","imageCaps":"delwedd","instanceFound":"Dangos 1 canlyniad ar gyfer '{0}' ","instancesFound":"Dangos {0} canlyniad o '{1}' ","nextResult":"Canlyniad nesaf","page":"tudalen","pageCaps":"tudalen","previousResult":"Canlyniad blaenorol","resultFoundFor":"canlyniad a geir ar gyfer","resultsFoundFor":"canlyniad ar gyfer","searchWithin":"Chwilio tu fewn i:"}},"settingsDialogue":{"content":{"locale":"Iaith","pagingEnabled":"Arddangos dwy dudalen","preserveViewport":"Cadw'r lefel o glosio","title":"Dewisiadau","website":"<a href='https://github.com/universalviewer/universalviewer'>mwy o wybodaeth</a>"}},"treeViewLeftPanel":{"options":{"elideCount":40,"galleryThumbHeight":320,"galleryThumbWidth":200,"oneColThumbHeight":320,"oneColThumbWidth":200,"pageModeEnabled":true,"panelAnimationDuration":250,"panelCollapsedWidth":30,"panelExpandedWidth":255,"panelOpen":true,"thumbsEnabled":true,"thumbsExtraHeight":8,"thumbsImageFadeInDuration":300,"thumbsLoadRange":15,"treeEnabled":true,"twoColThumbHeight":150,"twoColThumbWidth":90},"content":{"collapse":"Cuddio'r Cynnwys","collapseFull":"Cuddio'r Galeri","expand":"Ehangu'r Cynnwys","expandFull":"Ehangu'r Galeri","index":"Mynegai","thumbnails":"Bodluniau","title":"Cynnwys"}},"clickThroughDialogue":{"content":{"viewTerms":"Darllenwch Telerau ac Amodau Llawn"}}},"localisation":{"label":"Cymraeg","locales":[{"name":"cy-GB","label":"Cymraeg"},{"name":"en-GB","label":"English (GB)"}]},"content":{"canvasIndexOutOfRange":"Canfas yn rhy fawr i'w arddangos (ceisiwch eto)","degradedResource":"This image is degraded."}}